{
  "schemaVersion": 1,
  "artifactKind": "doe_native_program_identity_trace_validation",
  "inputs": {
    "trace": {
      "path": "examples/native-program-identity-dispatch.sample.json",
      "sha256": "1111111111111111111111111111111111111111111111111111111111111111"
    },
    "rowSchema": {
      "path": "config/native-program-identity-trace-row.schema.json",
      "sha256": "2222222222222222222222222222222222222222222222222222222222222222"
    },
    "artifactRoot": "bench/out/native-program-identity",
    "spirvValidator": "/usr/bin/spirv-val",
    "requireRenderCompletion": true
  },
  "counts": {
    "rows": 3,
    "processes": 1,
    "dispatches": 1,
    "renderDraws": 1,
    "submissions": 1,
    "artifacts": 3
  },
  "checks": {
    "rowSchemaValid": true,
    "processSequenceValid": true,
    "computeSubmissionValid": true,
    "renderCompletionValid": true,
    "backendArtifactsValid": true
  },
  "artifacts": [
    {
      "stage": "compute",
      "path": "bench/out/native-program-identity/doe-native-vulkan-3333333333333333333333333333333333333333333333333333333333333333.spv",
      "expectedSha256": "3333333333333333333333333333333333333333333333333333333333333333",
      "actualSha256": "3333333333333333333333333333333333333333333333333333333333333333",
      "spirvValPassed": true
    }
  ],
  "verdict": {
    "status": "passed",
    "failureCodes": [],
    "claimBoundary": "Native journal integrity only; not output, driver, or performance evidence."
  },
  "validationSha256": "4444444444444444444444444444444444444444444444444444444444444444"
}
